{"type":"config","name":"Optimize SQLite index creation and retrieval in pi-session-manager","metricName":"total_ms","metricUnit":"ms","bestDirection":"lower"}
{"run":1,"commit":"0afed5a","metric":0,"metrics":{},"status":"crash","description":"Baseline harness crash: project_path filter query returned zero hits because the synthetic dataset only put 'tokio async' into sessions whose cwd did not match /workspace/project-b. Need to rebalance fixture text so every query shape has stable hits before measuring performance.","timestamp":1774450153005,"segment":0,"confidence":null}
{"run":2,"commit":"0afed5a","metric":602.34,"metrics":{},"status":"checks_failed","description":"Baseline benchmark succeeded at 602.34ms, but checks failed for an unrelated existing feature-gating issue: CLI-only test invocation compiles `main-cli.rs`, which references `readonly::embedding*` APIs gated behind `gui`. Need to narrow checks to relevant search/migration tests under the normal feature set so correctness backpressure matches the code under study.","timestamp":1774450496234,"segment":0,"confidence":null}
{"run":3,"commit":"979b018","metric":604.36,"metrics":{},"status":"keep","description":"Baseline established with preserved benchmark harness (`autoresearch.sql_index_bench.rs`) and corrected checks. Median total time is 604.36ms across real init + indexing + mixed retrieval workload; ingest dominates at ~500.9ms, making session/message entry maintenance the most likely first optimization target.","timestamp":1774450897088,"segment":0,"confidence":null}
{"run":4,"commit":"ffb63b2","metric":570.687,"metrics":{},"status":"keep","description":"Improved pre-parsed message entry upsert path by eliminating the duplicate `DELETE FROM message_entries` and reusing a cached insert statement. This directly targets ingest overhead in `upsert_session` and reduced median total time from 604.36ms to 570.69ms (~5.6%), almost entirely from ingest (500.9ms -> 469.4ms).","timestamp":1774451388443,"segment":0,"confidence":282.5183168316857}
{"run":5,"commit":"ffb63b2","metric":582.002,"metrics":{},"status":"discard","description":"Discarded optimistic delete-only fast path in `delete_message_entries_for_session`. Removing the per-call table/schema probes looked promising, but median total time regressed to 582.00ms (vs best 570.69ms), with ingest rising back to 477.4ms. The branch probably benefited from SQLite’s existing happy-path behavior less than expected, so the extra recovery-oriented simplification is not a net win.","timestamp":1774451652907,"segment":0,"confidence":51.04991501923235}
{"run":6,"commit":"2c42768","metric":555.166,"metrics":{},"status":"keep","description":"Joined `sessions` directly inside `full_text_search` result SQL and removed per-hit `get_session()` lookups plus the temporary session cache. This cut median total time from 570.69ms to 555.17ms (~2.7%), with search dropping from 98.94ms to 96.51ms while preserving hit count and behavior.","timestamp":1774452355603,"segment":0,"confidence":27.296981020749232}
{"run":7,"commit":"2c42768","metric":589.585,"metrics":{},"status":"discard","description":"Discarded cached `sessions` upsert statement experiment. Despite one fast inner run, the 5-run median regressed badly to 589.59ms, with ingest/search variance increasing instead of falling. `prepare_cached` in this hot path did not produce a stable benefit and may interact poorly with the surrounding per-session work.","timestamp":1774452726266,"segment":0,"confidence":35.07825482576689}
{"run":8,"commit":"2c42768","metric":0,"metrics":{},"status":"crash","description":"Aborted the savepoint-wrapped `upsert_session` experiment after `./autoresearch.sh` appeared stuck during execution. The change introduces transaction/savepoint management around every session upsert; even without a final metric, the manual interruption makes this a failed experiment for the autonomous loop and it should be rolled back before trying a different path.","timestamp":1774487663694,"segment":0,"confidence":35.07825482576689}
{"run":9,"commit":"2c42768","metric":630.454,"metrics":{},"status":"discard","description":"Discarded removal of the outer `message_entries` existence guard in `upsert_session`. Although the existence check was redundant in theory, always entering the message-entry refresh path made the benchmark markedly worse (median 630.45ms, with both ingest and search drifting up). The extra unconditional work likely triggers recovery/schema paths more often than the saved metadata probe is worth.","timestamp":1774487735991,"segment":0,"confidence":37.57468697123526}
{"run":10,"commit":"2c42768","metric":588.059,"metrics":{},"status":"discard","description":"Discarded carrying `content` through the search CTE to remove the final `message_entries` join. On paper it should reduce one lookup, but in practice the wider intermediate rows increased median total time to 588.06ms and pushed search back above 100ms. Wider CTE payloads are not worth it here.","timestamp":1774487799540,"segment":0,"confidence":38.21351872246691}
{"run":11,"commit":"2c42768","metric":637.613,"metrics":{},"status":"discard","description":"Discarded composite lookup index `idx_message_entries_lookup(entry_id, session_path, source_type)`. It barely helped the search join but significantly increased index-maintenance cost during ingest, pushing median total time to 637.61ms. This path is classic over-indexing: more steel, slower ship.","timestamp":1774487887328,"segment":0,"confidence":37.57468697123526}
{"run":12,"commit":"2c42768","metric":651.599,"metrics":{},"status":"discard","description":"Discarded removal of the redundant table-existence probe inside `upsert_message_entries`. Counterintuitively it regressed hard to 651.60ms, so the saved query is not the bottleneck; the changed code shape likely defeated statement/cache behavior or simply exposed more variance in the write path. Not worth keeping.","timestamp":1774487938018,"segment":0,"confidence":28.298807217860993}
{"run":13,"commit":"2c42768","metric":598.524,"metrics":{},"status":"discard","description":"Discarded process-level caching of `includeThinkingInSearch`. It seemed like an obvious win because `load_include_thinking_in_search()` opens settings storage, but the measured result regressed to 598.52ms and search latency also drifted upward. Whatever overhead it removes is too small relative to the surrounding path, and the added cache plumbing is not paying rent.","timestamp":1774488093220,"segment":0,"confidence":33.60162207965128}
{"run":14,"commit":"2c42768","metric":0,"metrics":{},"status":"crash","description":"Aborted batch-ingest transaction experiment after `./autoresearch.sh` hung before the first inner run completed. Likely root cause: `upsert_sessions_batch` opens a write savepoint, then `upsert_message_entries -> load_include_thinking_in_search -> settings_store::get/open_db` opens a second connection that executes `CREATE TABLE IF NOT EXISTS settings`, introducing lock contention inside the batch write. This needs a same-connection / precomputed settings path before batching can be evaluated fairly.","timestamp":1774489343275,"segment":0,"confidence":33.60162207965128}
{"run":15,"commit":"2c42768","metric":667.09,"metrics":{},"status":"discard","description":"Discarded batch-ingest savepoint path even after removing the cross-connection settings-store lock hazard by precomputing `includeThinkingInSearch` once for the batch. It no longer hung, but median total time regressed badly to 667.09ms (ingest 555.89ms). The extra batch wrapper and scanner batching strategy are not helping this workload; transaction batching needs a different design or lower-level write path.","timestamp":1774489582892,"segment":0,"confidence":23.04788790866629}
{"run":16,"commit":"2c42768","metric":744.501,"metrics":{},"status":"discard","description":"Discarded the combined experiment of production-style batch session upserts plus single-query total-hit computation in `full_text_search`. It cut search to 83.89ms, but ingest exploded to 656.78ms and total time regressed to 744.50ms. The search-side idea may still be worth isolating later, but bundling it with batch upserts obscures the result and the write-path regression dominates.","timestamp":1774489715189,"segment":0,"confidence":19.746958810557075}
{"run":17,"commit":"2c42768","metric":582.608,"metrics":{},"status":"discard","description":"First isolated test of single-query `total_hits` computation in `full_text_search`: folded the count into the paged data query via `COUNT(*) OVER ()`. Search latency dropped dramatically (96.51ms -> 69.49ms), but total time still regressed to 582.61ms because ingest variance swamped the win. Promising search-side signal, so worth one confirmation rerun before final judgment.","timestamp":1774489864916,"segment":0,"confidence":23.04788790866629}
{"run":18,"commit":"2c42768","metric":597.634,"metrics":{},"status":"discard","description":"Confirmation rerun for single-query `total_hits` computation still regressed: 597.63ms median total with search at 73.70ms. So the search-side win is real, but it is not enough to improve the primary metric on this mixed workload. Discarding this path for now to avoid overfitting to retrieval-only gains.","timestamp":1774489874347,"segment":0,"confidence":33.60162207965128}
{"run":19,"commit":"2c42768","metric":687.752,"metrics":{},"status":"discard","description":"Discarded direct iteration over normalized `SessionEntry.message.content` in `upsert_message_entries`. In theory it should skip regrouping allocations, but in practice it regressed heavily to 687.75ms and also hurt search. The previous regrouping logic, ugly as it is, apparently aligns better with the current data shape and SQLite write behavior.","timestamp":1774489974544,"segment":0,"confidence":23.04788790866629}
{"run":20,"commit":"2c42768","metric":657.671,"metrics":{},"status":"discard","description":"Discarded `PRAGMA temp_store=MEMORY`. It looked like a plausible boost for window-function-heavy search, but on this workload it regressed across the board to 657.67ms, with both ingest and search slower. So SQLite’s default temp-store behavior is already the better tradeoff here.","timestamp":1774490090122,"segment":0,"confidence":19.746958810557075}
{"run":21,"commit":"2c42768","metric":687.801,"metrics":{},"status":"discard","description":"Discarded one-time schema-readiness cache for `delete_message_entries_for_session`. It looked like a middle ground between full validation and the failed optimistic delete-only path, but it regressed catastrophically to 687.80ms. The cache bookkeeping and altered control flow are not helping; this hot path is more fragile than expected.","timestamp":1774490237864,"segment":0,"confidence":18.57767664430206}
{"run":22,"commit":"df6ee2b","metric":322.192,"metrics":{},"status":"keep","description":"Major ingest win: rewrote pre-parsed `upsert_message_entries` to batch many rows into a single multi-value `INSERT OR REPLACE` statement per chunk instead of executing one insert per segment. This is a real write-path redesign, not benchmark trickery, and it slashed median total time from 555.17ms to 322.19ms (~42%) by cutting ingest from 457.40ms to 214.62ms. Search got slightly slower (~104.95ms), but the primary metric improved overwhelmingly.","timestamp":1774490426577,"segment":0,"confidence":10.17887719963352}
{"run":23,"commit":"0d1f997","metric":290.133,"metrics":{},"status":"keep","description":"Stacked a second real win on top of batched message-entry writes: folded `total_hits` into the paged `full_text_search` query via `COUNT(*) OVER ()`, eliminating the separate count query on the common path. With ingest now cheap, the search improvement finally matters: total time fell from 322.19ms to 290.13ms (~9.9%) and search dropped from 104.95ms to 71.52ms while preserving hit count and behavior.","timestamp":1774490555235,"segment":0,"confidence":8.634525244408735}
{"run":24,"commit":"0d1f997","metric":294.95,"metrics":{},"status":"discard","description":"Discarded `prepare_cached` on the dynamic bulk-insert SQL for chunked message-entry writes. Since the SQL text varies with chunk size and is already cheap relative to the batched write itself, statement caching added overhead instead of helping; median total regressed from 290.13ms to 294.95ms.","timestamp":1774490623573,"segment":0,"confidence":7.422369464555235}
{"run":25,"commit":"0d1f997","metric":323.933,"metrics":{},"status":"discard","description":"Discarded replacing the `global_rn` page filter with `ORDER BY rank LIMIT/OFFSET` inside the filtered CTE. It simplified the query shape, but median total regressed to 323.93ms and search also rose from 71.52ms to 77.91ms. So SQLite liked the previous `ROW_NUMBER()` pagination plan better on this workload.","timestamp":1774490734962,"segment":0,"confidence":7.038048685822407}
{"run":26,"commit":"0d1f997","metric":300.621,"metrics":{},"status":"discard","description":"Discarded increasing bulk message-entry insert chunk size from 64 to 128. Larger chunks looked tempting after the big batched-write win, but median total regressed from 290.13ms to 300.62ms, so 64 is already in the sweet spot for this workload. Bigger SQL payloads appear to lose more in prepare/execute overhead than they save in statement count.","timestamp":1774490787492,"segment":0,"confidence":6.831802769143832}
{"run":27,"commit":"1152172","metric":281.054,"metrics":{},"status":"keep","description":"Kept chunk-size retuning for bulk message-entry inserts: reducing the multi-row insert chunk from 64 to 32 improved the new batched write path. Median total fell from 290.13ms to 281.05ms (~3.1%), with ingest dropping from 215.47ms to 205.38ms while search stayed effectively flat. So the write-path redesign still had headroom, and smaller chunks fit SQLite’s execute/parse tradeoff better here.","timestamp":1774490828281,"segment":0,"confidence":5.5112409675173755}
{"run":28,"commit":"1152172","metric":319.73,"metrics":{},"status":"discard","description":"Discarded shrinking the bulk insert chunk size further from 32 to 16. That pushed statement count back up too much and regressed median total to 319.73ms, with ingest rising to 240.92ms. So the sweet spot is not 'as small as possible'; 32 remains the better tradeoff.","timestamp":1774490872599,"segment":0,"confidence":4.532105653562097}
